{
  "$schema": "https://json-schema.org/draft/2020-12/schema",
  "$id": "https://traffictracer.local/contracts/flow.schema.json",
  "title": "TrafficTracer Complete correlated flow",
  "type": "object",
  "additionalProperties": false,
  "required": [
    "schema_version",
    "session_id",
    "flow_id",
    "protocol",
    "pre_flow",
    "post_flow",
    "shared",
    "match",
    "request_ids"
  ],
  "properties": {
    "schema_version": { "const": 1 },
    "session_id": { "$ref": "#/$defs/uuid" },
    "flow_id": { "type": "string", "minLength": 1, "maxLength": 256 },
    "url": { "type": "string", "pattern": "^https?://[^\\s]+$" },
    "primary_url": { "type": "string", "pattern": "^https?://[^\\s]+$" },
    "urls": { "type": "array", "uniqueItems": true, "items": { "type": "string", "pattern": "^https?://[^\\s]+$" } },
    "connection_ids": { "type": "array", "uniqueItems": true, "items": { "type": "string", "pattern": "^conn-[0-9a-f]{32}(-[0-9a-f]{8})?$" } },
    "resource_type": { "type": "string" },
    "relation": { "type": "string" },
    "protocol": { "enum": ["tcp", "udp"] },
    "pre_flow": { "$ref": "#/$defs/flowTuple" },
    "post_flow": {
      "oneOf": [
        { "$ref": "#/$defs/flowTuple" },
        { "type": "null" }
      ]
    },
    "shared": { "type": "boolean" },
    "match": { "$ref": "#/$defs/match" },
    "request_ids": {
      "type": "array",
      "uniqueItems": true,
      "items": { "type": "string", "minLength": 1 }
    },
    "conn_id": { "type": "string" },
    "outer_conn_id": { "type": "string" },
    "inbound_name": { "type": "string" },
    "carrier_binding": { "$ref": "#/$defs/carrierBinding" },
    "carrier_state": { "enum": ["exclusive_bound", "shared_bound", "not_applicable", "failed_before_carrier", "observation_missing"] },
    "egress_outcome": {
      "enum": ["direct", "proxy", "rejected", "rejected_drop", "internal_dns", "pass", "compatible", "unknown"]
    },
    "terminal": { "oneOf": [{ "$ref": "#/$defs/terminal" }, { "type": "null" }] },
    "egress_evidence_kind": { "enum": ["exclusive_socket", "shared_carrier", "explicit_no_socket", "failed_before_socket", "local_not_applicable", "carrier_binding_unavailable", "carrier_path_unavailable", "egress_unavailable"] },
    "attribution_scope": { "enum": ["page_attributed", "browser_background", "capture_unattributed", "local_internal"] },
    "attribution_evidence": { "type": "array", "minItems": 1, "uniqueItems": true, "items": { "type": "string", "minLength": 1 } },
    "post_flow_disposition": { "enum": ["with_post_flow", "explicit_no_socket", "failed_before_socket", "local_not_applicable", "unexpected_missing"] }
  },
  "$defs": {
    "uuid": {
      "type": "string",
      "pattern": "^[0-9a-fA-F]{8}-[0-9a-fA-F]{4}-[1-5][0-9a-fA-F]{3}-[89abAB][0-9a-fA-F]{3}-[0-9a-fA-F]{12}$"
    },
    "ipAddress": {
      "type": "string",
      "oneOf": [
        { "format": "ipv4" },
        { "format": "ipv6" }
      ]
    },
    "flowTuple": {
      "type": "object",
      "additionalProperties": false,
      "required": ["network", "src_ip", "src_port", "dst_ip", "dst_port", "complete", "source", "shared"],
      "properties": {
        "network": { "enum": ["tcp", "udp"] },
        "src_ip": { "$ref": "#/$defs/ipAddress" },
        "src_port": { "type": "integer", "minimum": 1, "maximum": 65535 },
        "dst_ip": { "$ref": "#/$defs/ipAddress" },
        "dst_port": { "type": "integer", "minimum": 1, "maximum": 65535 },
        "dst_host": { "type": "string" },
        "complete": { "type": "boolean" },
        "source": { "type": "string", "minLength": 1 },
        "scope": { "enum": ["pre_proxy", "post_proxy"] },
        "shared": { "type": "boolean" }
      }
    },
    "carrierBinding": {
      "type": "object", "additionalProperties": false,
      "required": ["carrier_id", "status", "mode", "relation", "generation", "protocol", "physical_paths"],
      "properties": {
        "carrier_id": { "type": "string", "minLength": 1, "maxLength": 256 },
        "status": { "enum": ["exclusive_bound", "shared_bound"] },
        "mode": { "enum": ["exclusive", "shared"] },
        "relation": { "enum": ["created", "reused", "observed"] },
        "generation": { "type": "integer", "minimum": 0 },
        "protocol": { "type": "string", "minLength": 1 },
        "physical_paths": { "type": "array", "items": { "$ref": "#/$defs/flowTuple" } }
      }
    },
    "terminal": {
      "type": "object", "additionalProperties": false,
      "required": ["status", "stage", "error", "error_class", "error_class_source"],
      "properties": {
        "status": { "type": "string", "minLength": 1 },
        "stage": { "type": "string" },
        "error": { "type": "string" },
        "error_class": { "type": "string" },
        "error_class_source": { "enum": ["core_explicit", "legacy_inferred", "unavailable"] }
      }
    },
    "match": {
      "type": "object",
      "additionalProperties": false,
      "required": ["status", "confidence", "candidate_count"],
      "properties": {
        "status": { "enum": ["matched", "unmatched", "ambiguous", "legacy"] },
        "confidence": { "type": "number", "minimum": 0, "maximum": 1 },
        "candidate_count": { "type": "integer", "minimum": 0 },
        "reason": { "type": "string" }
      }
    }
  }
}
